{
  "schema": "gentle-ai.work-status/v1",
  "contract": "gentle-ai.work-status/v1",
  "workRunId": "work-sdd-proposal",
  "revision": "sha256:aaaaaaaaaaaaaaaaaaaaaaaaaaaaaaaaaaaaaaaaaaaaaaaaaaaaaaaaaaaaaaaa",
  "publicState": "needs_your_decision",
  "routeDecision": "propose_sdd",
  "routePhase": "decision_pending",
  "verification": {
    "outcome": "pending",
    "resultRefs": []
  },
  "deliveryIntentRef": "sha256:bbbbbbbbbbbbbbbbbbbbbbbbbbbbbbbbbbbbbbbbbbbbbbbbbbbbbbbbbbbbbbbb"
}
